<?xml version="1.0" encoding="UTF-8"?>
<!--
/***********************************************************************************************************************
 * Copyright (c) 2008 empolis GmbH and brox IT Solutions GmbH. All rights reserved. This program and the accompanying
 * materials are made available under the terms of the Eclipse Public License v1.0 which accompanies this distribution,
 * and is available at http://www.eclipse.org/legal/epl-v10.html
 *
 * Contributors: Ivan Churkin (brox IT Solutions GmbH) - initial creator
 **********************************************************************************************************************/
-->
<QueueWorkerRecordRecyclerJob xmlns="http://www.eclipse.org/smila/queue"
  xmlns:xsi="http://www.w3.org/2001/XMLSchema-instance"
  xsi:noNamespaceSchemaLocation="../schemas/QueueWorkerConfig.xsd"
>

  <Rule Name="First recycle Rule">
    <Condition>DataSourceID='myDataSource'</Condition>
    <Task>
      <Send BrokerId="broker1" Queue="SMILA.connectivity" RecordFilter="nothing"/>
    </Task>
  </Rule>
  
  <Rule Name="Second recycle Rule">
    <Condition>NOT(DataSourceID='myDataSource')</Condition>
    <Task>
      <Send BrokerId="broker1" Queue="SMILA.connectivity" RecordFilter="nothing">
        <SetProperty Name="doAdd">no</SetProperty>
      </Send>
    </Task>
  </Rule>
  
</QueueWorkerRecordRecyclerJob>